{
  "mode": "ext.multi_round.v1",
  "initiator": "agent://coordinator",
  "participants": [
    "agent://coordinator",
    "agent://alice",
    "agent://bob"
  ],
  "mode_version": "1.0.0",
  "configuration_version": "cfg-1",
  "policy_version": "",
  "ttl_ms": 60000,
  "messages": [
    {
      "sender": "agent://alice",
      "message_type": "Contribute",
      "payload_type": "multi_round.Contribute",
      "payload": {
        "value": "option_a"
      },
      "expect": "accept"
    },
    {
      "sender": "agent://bob",
      "message_type": "Contribute",
      "payload_type": "multi_round.Contribute",
      "payload": {
        "value": "option_b"
      },
      "expect": "accept"
    },
    {
      "sender": "agent://bob",
      "message_type": "Contribute",
      "payload_type": "multi_round.Contribute",
      "payload": {
        "value": "option_a"
      },
      "expect": "accept"
    },
    {
      "sender": "agent://coordinator",
      "message_type": "Commitment",
      "payload_type": "Commitment",
      "payload": {
        "commitment_id": "c1",
        "outcome_positive": true,
        "action": "multi_round.converged",
        "authority_scope": "test",
        "reason": "done",
        "mode_version": "1.0.0",
        "policy_version": "",
        "configuration_version": "cfg-1"
      },
      "expect": "accept"
    }
  ],
  "expected_final_state": "Resolved"
}
