{
  "mode": "macp.mode.proposal.v1",
  "initiator": "agent://buyer",
  "participants": [
    "agent://buyer",
    "agent://seller"
  ],
  "mode_version": "1.0.0",
  "configuration_version": "cfg-1",
  "policy_version": "",
  "ttl_ms": 60000,
  "messages": [
    {
      "sender": "agent://seller",
      "message_type": "Proposal",
      "payload_type": "macp.modes.proposal.v1.ProposalPayload",
      "payload": {
        "proposal_id": "p1",
        "title": "offer",
        "summary": "terms",
        "details": [],
        "tags": []
      },
      "expect": "accept"
    },
    {
      "sender": "agent://buyer",
      "message_type": "Accept",
      "payload_type": "macp.modes.proposal.v1.AcceptPayload",
      "payload": {
        "proposal_id": "p1",
        "reason": ""
      },
      "expect": "accept"
    },
    {
      "sender": "agent://seller",
      "message_type": "Accept",
      "payload_type": "macp.modes.proposal.v1.AcceptPayload",
      "payload": {
        "proposal_id": "p1",
        "reason": ""
      },
      "expect": "accept"
    },
    {
      "sender": "agent://buyer",
      "message_type": "Commitment",
      "payload_type": "macp.v1.CommitmentPayload",
      "payload": {
        "commitment_id": "c1",
        "action": "proposal.accepted",
        "authority_scope": "test",
        "reason": "done",
        "mode_version": "1.0.0",
        "policy_version": "policy.default",
        "configuration_version": "cfg-1",
        "outcome_positive": true
      },
      "expect": "accept"
    }
  ],
  "expected_final_state": "Resolved",
  "expect_resolution_present": true,
  "expected_resolution": {
    "action": "proposal.accepted",
    "mode_version": "1.0.0",
    "configuration_version": "cfg-1",
    "outcome_positive": true
  },
  "expected_mode_state": {
    "phase": "Committed",
    "accepts": {
      "agent://buyer": "p1",
      "agent://seller": "p1"
    },
    "proposals": {
      "p1": {
        "proposal_id": "p1",
        "proposer": "agent://seller",
        "disposition": "Live"
      }
    }
  }
}
